{
  "$schema": "../../../schema/evolution-step.schema.json",
  "id": "step-015",
  "sequence": 15,
  "before_version": "v014",
  "after_version": "v015",
  "prompts": [
    {
      "order": 1,
      "path": "prompts/001.md"
    }
  ],
  "scenario_types": ["add", "modify"],
  "expected_changes": [
    {
      "id": "change-001",
      "operation": "add",
      "features_before": [],
      "features_after": ["Authentication", "Login", "Registration", "PersistAccounts", "PasswordHashing", "SessionManagement", "Logout"],
      "description": "Add authentification"
    },
    {
      "id": "change-002",
      "operation": "modify",
      "features_before": ["PersistAccounts"],
      "features_after": ["UserDataIsolation", "UserScopedPersistence"],
      "description": "Make data user related"
    }
  ],
  "ground_truth": "ground-truth"
}
