{
  "$schema": "../../../schema/evolution-step.schema.json",
  "id": "step-009",
  "sequence": 9,
  "before_version": "v008",
  "after_version": "v009",
  "prompts": [
    {
      "order": 1,
      "path": "prompts/001.md"
    }
  ],
  "scenario_types": ["split"],
  "expected_changes": [
    {
      "id": "change-001",
      "operation": "split",
      "features_before": ["TaskPriority"],
      "features_after": ["TaskPriorityLevels", "PriorityOrdering"],
      "description": "Split TaskPriority in two features"
    }
  ],
  "ground_truth": "ground-truth"
}
