{
  "$schema": "../../../schema/evolution-step.schema.json",
  "id": "step-002",
  "sequence": 2,
  "before_version": "v001",
  "after_version": "v002",
  "prompts": [
    {
      "order": 1,
      "path": "prompts/001.md"
    },
    {
      "order": 1,
      "path": "prompts/002.md"
    }
  ],
  "scenario_types": ["add"],
  "expected_changes": [
    {
      "id": "change-001",
      "operation": "add",
      "features_before": ["TaskManager, TaskManagement, CreateTasks, Labels, CreateLabels, AssignTaskLabels, PersistLabels"],
      "features_after": ["TaskManager, TaskManagement, CreateTasks, KeywordSearch, Labels, CreateLabels, AssignTaskLabels, PersistLabels"],
      "description": "Add keyword search"
    },
    {
      "id": "change-002",
      "operation": "add",
      "features_before": ["TaskManager, TaskManagement, CreateTasks, Labels, CreateLabels, AssignTaskLabels, PersistLabels"],
      "features_after": ["TaskManager, TaskManagement, CreateTasks, KeywordSearch, StatusFilter, Labels, CreateLabels, AssignTaskLabels, PersistLabels"],
      "description": "Add status filter"
    }
  ],
  "ground_truth": "ground-truth"
}
