{
  "$schema": "../../../schema/evolution-step.schema.json",
  "id": "step-004",
  "sequence": 4,
  "before_version": "v003",
  "after_version": "v004",
  "prompts": [
    {
      "order": 1,
      "path": "prompts/001.md"
    },
    {
      "order": 2,
      "path": "prompts/002.md"
    }
  ],
  "scenario_types": ["add", "modify"],
  "expected_changes": [
    {
      "id": "change-001",
      "operation": "add",
      "features_before": [],
      "features_after": ["TaskPriority"],
      "description": "Add priorities to tasks"
    },
    {
      "id": "change-002",
      "operation": "modify",
      "features_before": ["TaskPriority"],
      "features_after": ["TaskPriority"],
      "description": "Modify priority listing"
    }
  ],
  "ground_truth": "ground-truth"
}
