{
  "$schema": "../../../schema/evolution-step.schema.json",
  "id": "step-001",
  "sequence": 1,
  "before_version": "v000",
  "after_version": "v001",
  "prompts": [
    {
      "order": 1,
      "path": "prompts/001.md"
    }
  ],
  "scenario_types": ["add"],
  "expected_changes": [
    {
      "id": "change-001",
      "operation": "add",
      "features_before": [],
      "features_after": ["TaskManager, TaskManagement, CreateTasks, Labels, CreateLabels, AssignTaskLabels, PersistLabels"],
      "description": "Adds label management to the task manager, including creating labels, assigning labels to tasks, and persisting labels and their task assignments."
    }
  ],
  "ground_truth": "ground-truth"
}
