{
  "$schema": "../../../schema/evolution-step.schema.json",
  "id": "step-012",
  "sequence": 12,
  "before_version": "v011",
  "after_version": "v012",
  "prompts": [
    {
      "order": 1,
      "path": "prompts/001.md"
    }
  ],
  "scenario_types": ["add"],
  "expected_changes": [
    {
      "id": "change-001",
      "operation": "add",
      "features_before": [],
      "features_after": ["ArchiveTasks", "ShowArchivedTasks"],
      "description": "Add archive tasks"
    }
  ],
  "ground_truth": "ground-truth"
}
