{
  "$schema": "../../../schema/evolution-step.schema.json",
  "id": "step-013",
  "sequence": 13,
  "before_version": "v012",
  "after_version": "v013",
  "prompts": [
    {
      "order": 1,
      "path": "prompts/001.md"
    },
    {
      "order": 2,
      "path": "prompts/002.md"
    },
    {
      "order": 3,
      "path": "prompts/003.md"
    }
  ],
  "scenario_types": ["remove"],
  "expected_changes": [
    {
      "id": "change-001",
      "operation": "remove",
      "features_before": ["ArchiveTasks", "ShowArchivedTasks"],
      "features_after": [],
      "description": "Remove archive tasks"
    }
  ],
  "ground_truth": "ground-truth"
}
