{
  "$schema": "../../../schema/evolution-step.schema.json",
  "id": "step-006",
  "sequence": 6,
  "before_version": "v005",
  "after_version": "v006",
  "prompts": [
    {
      "order": 1,
      "path": "prompts/001.md"
    }
  ],
  "scenario_types": ["rename"],
  "expected_changes": [
    {
      "id": "change-001",
      "operation": "rename",
      "features_before": ["Labels"],
      "features_after": ["Tags"],
      "description": "Rename labels to tags"
    }
  ],
  "ground_truth": "ground-truth"
}
