{
  "$schema": "../../../schema/evolution-step.schema.json",
  "id": "step-008",
  "sequence": 8,
  "before_version": "v007",
  "after_version": "v008",
  "prompts": [
    {
      "order": 1,
      "path": "prompts/001.md"
    },
    {
      "order": 2,
      "path": "prompts/002.md"
    }
  ],
  "scenario_types": ["add"],
  "expected_changes": [
    {
      "id": "change-001",
      "operation": "add",
      "features_before": [],
      "features_after": ["DeleteTasks", "RenameTasks"],
      "description": "Add delete and rename features"
    }
  ],
  "ground_truth": "ground-truth"
}
