{
  "$schema": "../../../schema/evolution-step.schema.json",
  "id": "step-003",
  "sequence": 3,
  "before_version": "v002",
  "after_version": "v003",
  "prompts": [
    {
      "order": 1,
      "path": "prompts/001.md"
    },
    {
      "order": 2,
      "path": "prompts/002.md"
    }
  ],
  "scenario_types": ["modify", "add"],
  "expected_changes": [
    {
      "id": "change-001",
      "operation": "modify",
      "features_before": ["AssignTaskLabels", "Labels"],
      "features_after": ["AssignTaskLabels", "Labels", "LabelColors"],
      "description": "Add label colors and enable multiple selection"
    },
    {
      "id": "change-002",
      "operation": "add",
      "features_before": [],
      "features_after": ["RenameLabels", "DeleteLabels"],
      "description": "Add rename and delete options to labels"
    }
  ],
  "ground_truth": "ground-truth"
}
